{"$id":"schemas/evidentrail/v1/expansion_request.schema.json","$schema":"https://json-schema.org/draft/2020-12/schema","additionalProperties":false,"properties":{"after":{"format":"uint64","maximum":9007199254740991,"minimum":0,"type":"integer"},"before":{"format":"uint64","maximum":9007199254740991,"minimum":0,"type":"integer"},"contract":{"const":"evidentrail.expansion_request","type":"string"},"contract_version":{"const":1,"format":"uint16","maximum":9007199254740991,"minimum":0,"type":"integer"},"evidence_reference_id":{"pattern":"^eref_[0-9a-f]{64}$","type":"string"},"max_bytes":{"format":"uint64","maximum":9007199254740991,"minimum":0,"type":"integer"},"max_events":{"format":"uint64","maximum":9007199254740991,"minimum":0,"type":"integer"},"relation":{"type":"string"},"result_id":{"pattern":"^result_[0-9a-f]{64}$","type":"string"}},"required":["contract","contract_version","result_id","evidence_reference_id","relation","max_events","max_bytes","before","after"],"title":"evidentrail.expansion_request","type":"object"}