{"after":0,"before":0,"contract":"evidentrail.expansion_request","contract_version":1,"evidence_reference_id":"eref_0000000000000000000000000000000000000000000000000000000000000000","max_bytes":1,"max_events":1,"relation":"exact","result_id":"result_0000000000000000000000000000000000000000000000000000000000000000"}